{
  "schema_version": "1.0",
  "run": {
    "name": "example-base",
    "created_at": "2026-10-18T08:09:19Z",
    "sbretire_version": "1.0.0",
    "config_file": "model.example.yaml",
    "config_sha256": "4900be0dc466edb25e759078589b1ff2c7941c98b84fe04336bac897537d0901",
    "seed": {
      "value": "42",
      "source": "config"
    },
    "as_of_date": "2026-10-01",
    "horizon_years": 100,
    "last_month": "2126-09",
    "paths": 100000,
    "monthly_budget_today": 6667.0,
    "annual_return": 0.04,
    "options": {
      "end_reserve_months": 0,
      "spend_at_least_income": false
    }
  },
  "people": [
    {
      "id": "person_1",
      "name": "Person 1"
    },
    {
      "id": "person_2",
      "name": "Person 2"
    }
  ],
  "inputs": [
    {
      "section": "model",
      "item": "model.currency",
      "label": "Currency",
      "value": "GBP",
      "unit": ""
    },
    {
      "section": "model",
      "item": "model.as_of_date",
      "label": "As-of date (first simulated month)",
      "value": "2026-10-01",
      "unit": "date"
    },
    {
      "section": "model",
      "item": "model.simulation_count",
      "label": "Simulated paths",
      "value": "100000",
      "unit": "paths"
    },
    {
      "section": "model",
      "item": "model.confidence_levels",
      "label": "Target success rates",
      "value": "0.9;0.95;0.99",
      "unit": "share of paths"
    },
    {
      "section": "model",
      "item": "model.frequency",
      "label": "Time step",
      "value": "monthly",
      "unit": ""
    },
    {
      "section": "model",
      "item": "model.horizon_years",
      "label": "Horizon",
      "value": "100",
      "unit": "years"
    },
    {
      "section": "model",
      "item": "model.random_seed",
      "label": "Random seed (empty = generate one)",
      "value": "42",
      "unit": ""
    },
    {
      "section": "model",
      "item": "model.unknown_keys",
      "label": "Unknown config keys",
      "value": "error",
      "unit": ""
    },
    {
      "section": "portfolio",
      "item": "portfolio.starting_balance",
      "label": "Starting balance",
      "value": "1000000.0",
      "unit": "GBP"
    },
    {
      "section": "portfolio",
      "item": "portfolio.annual_return",
      "label": "Fixed annual return (after fees)",
      "value": "0.04",
      "unit": "annual effective rate (0.05 = 5%)"
    },
    {
      "section": "budget",
      "item": "budget.monthly_amount_today",
      "label": "Monthly budget",
      "value": "6667.0",
      "unit": "GBP/month, today's money"
    },
    {
      "section": "budget",
      "item": "budget.survivor_budget_factor",
      "label": "Survivor budget factor (household default)",
      "value": "0.7",
      "unit": "share of the budget"
    },
    {
      "section": "budget",
      "item": "budget.end_reserve_months",
      "label": "End-of-life reserve (0 = off)",
      "value": "0",
      "unit": "months of budget"
    },
    {
      "section": "budget",
      "item": "budget.spend_at_least_income",
      "label": "Spend at least each month's income",
      "value": "false",
      "unit": ""
    },
    {
      "section": "inflation",
      "item": "inflation.source",
      "label": "Inflation source",
      "value": "UK_CPI",
      "unit": ""
    },
    {
      "section": "inflation",
      "item": "inflation.source_period",
      "label": "Calibration period",
      "value": "1989-2025",
      "unit": "years"
    },
    {
      "section": "inflation",
      "item": "inflation.data_file",
      "label": "CPI data file",
      "value": "uk_cpi.csv",
      "unit": "file"
    },
    {
      "section": "inflation",
      "item": "inflation.model",
      "label": "Inflation model",
      "value": "ar1_lognormal",
      "unit": ""
    },
    {
      "section": "inflation",
      "item": "inflation.parameter_units",
      "label": "Parameter units",
      "value": "log_annual",
      "unit": ""
    },
    {
      "section": "inflation",
      "item": "inflation.log_mean",
      "label": "Long-run mean of log(1 + inflation)",
      "value": "0.0277",
      "unit": "log annual"
    },
    {
      "section": "inflation",
      "item": "inflation.ar1_coefficient",
      "label": "AR(1) persistence",
      "value": "0.6179",
      "unit": ""
    },
    {
      "section": "inflation",
      "item": "inflation.innovation_sd",
      "label": "Yearly shock SD of log(1 + inflation)",
      "value": "0.0154",
      "unit": "log annual"
    },
    {
      "section": "inflation",
      "item": "inflation.initial_rate",
      "label": "Inflation in the year before the as-of date",
      "value": "0.034",
      "unit": "annual rate"
    },
    {
      "section": "mortality",
      "item": "mortality.source",
      "label": "Mortality source",
      "value": "ONS_2024_BASED",
      "unit": ""
    },
    {
      "section": "mortality",
      "item": "mortality.geography",
      "label": "Geography",
      "value": "UK",
      "unit": ""
    },
    {
      "section": "mortality",
      "item": "mortality.projection",
      "label": "Projection",
      "value": "principal",
      "unit": ""
    },
    {
      "section": "mortality",
      "item": "mortality.data_file",
      "label": "Mortality data file",
      "value": "ons_mortality.csv",
      "unit": "file"
    },
    {
      "section": "people",
      "item": "people[person_1].id",
      "label": "Person 1: Id",
      "value": "person_1",
      "unit": ""
    },
    {
      "section": "people",
      "item": "people[person_1].name",
      "label": "Person 1: Name",
      "value": "Person 1",
      "unit": ""
    },
    {
      "section": "people",
      "item": "people[person_1].date_of_birth",
      "label": "Person 1: Date of birth",
      "value": "1960-01-14",
      "unit": "date"
    },
    {
      "section": "people",
      "item": "people[person_1].sex",
      "label": "Person 1: Sex (mortality table)",
      "value": "male",
      "unit": ""
    },
    {
      "section": "people",
      "item": "people[person_1].survivor_budget_factor",
      "label": "Person 1: Survivor budget factor when this person survives (empty = household default)",
      "value": "0.7",
      "unit": "share of the budget"
    },
    {
      "section": "people",
      "item": "people[person_2].id",
      "label": "Person 2: Id",
      "value": "person_2",
      "unit": ""
    },
    {
      "section": "people",
      "item": "people[person_2].name",
      "label": "Person 2: Name",
      "value": "Person 2",
      "unit": ""
    },
    {
      "section": "people",
      "item": "people[person_2].date_of_birth",
      "label": "Person 2: Date of birth",
      "value": "1969-05-01",
      "unit": "date"
    },
    {
      "section": "people",
      "item": "people[person_2].sex",
      "label": "Person 2: Sex (mortality table)",
      "value": "female",
      "unit": ""
    },
    {
      "section": "people",
      "item": "people[person_2].survivor_budget_factor",
      "label": "Person 2: Survivor budget factor when this person survives (empty = household default)",
      "value": "0.7",
      "unit": "share of the budget"
    },
    {
      "section": "income",
      "item": "income[state_pension_1].id",
      "label": "UK State Pension: Id",
      "value": "state_pension_1",
      "unit": ""
    },
    {
      "section": "income",
      "item": "income[state_pension_1].name",
      "label": "UK State Pension: Name",
      "value": "UK State Pension",
      "unit": ""
    },
    {
      "section": "income",
      "item": "income[state_pension_1].start_date",
      "label": "UK State Pension: First month paid",
      "value": "2027-09-01",
      "unit": "date"
    },
    {
      "section": "income",
      "item": "income[state_pension_1].end_date",
      "label": "UK State Pension: First month no longer paid (empty = no end)",
      "value": "",
      "unit": "date"
    },
    {
      "section": "income",
      "item": "income[state_pension_1].annual_amount_today",
      "label": "UK State Pension: Annual amount",
      "value": "10000.0",
      "unit": "GBP/year, today's money"
    },
    {
      "section": "income",
      "item": "income[state_pension_1].inflation_linked",
      "label": "UK State Pension: Rises with inflation",
      "value": "true",
      "unit": ""
    },
    {
      "section": "income",
      "item": "income[state_pension_1].survivor_percentage",
      "label": "UK State Pension: Share paid after the recipient's death",
      "value": "1.0",
      "unit": "share"
    },
    {
      "section": "income",
      "item": "income[state_pension_1].recipient",
      "label": "UK State Pension: Recipient",
      "value": "person_1",
      "unit": "person id or household"
    },
    {
      "section": "income",
      "item": "income[state_pension_2].id",
      "label": "UK State Pension: Id",
      "value": "state_pension_2",
      "unit": ""
    },
    {
      "section": "income",
      "item": "income[state_pension_2].name",
      "label": "UK State Pension: Name",
      "value": "UK State Pension",
      "unit": ""
    },
    {
      "section": "income",
      "item": "income[state_pension_2].start_date",
      "label": "UK State Pension: First month paid",
      "value": "2028-09-01",
      "unit": "date"
    },
    {
      "section": "income",
      "item": "income[state_pension_2].end_date",
      "label": "UK State Pension: First month no longer paid (empty = no end)",
      "value": "",
      "unit": "date"
    },
    {
      "section": "income",
      "item": "income[state_pension_2].annual_amount_today",
      "label": "UK State Pension: Annual amount",
      "value": "10000.0",
      "unit": "GBP/year, today's money"
    },
    {
      "section": "income",
      "item": "income[state_pension_2].inflation_linked",
      "label": "UK State Pension: Rises with inflation",
      "value": "true",
      "unit": ""
    },
    {
      "section": "income",